Auteur,Date,Commentaire,Note
JULIE | France | 11/12/2024,2024-12-11T08:23:15+0100,agréables à porter et bon amorti,5/5
PIERRETTE | France | 11/12/2024,2024-12-11T08:19:43+0100,Bon produit,5/5
VANESSA | France | 10/12/2024,2024-12-10T20:34:23+0100,Bon rapport qualité prix,5/5
JEAN CHARLES | France | 10/12/2024,2024-12-10T19:03:24+0100,tiens bien au pied,5/5
BARBARA | Femme | France | 10/12/2024,2024-12-10T09:11:33+0100,"Utilisée pour la salle de sport et sur tapis de course, ces chaussures assurent un bon maintien",5/5
VIRGINIE | France | 09/12/2024,2024-12-09T21:17:39+0100,Semelle dure Matériaux passables pour la transpiration,3/5
NADINE | France | 10/12/2024,2024-12-10T08:39:32+0100,"achetées pour le travail, debout 10 h par jour. parfait",5/5
Florence | France | 09/12/2024,2024-12-09T18:04:36+0100,Sa fait longtemps que je prend ce modèle et j en suis très contente,5/5
Margaux | Femme | France | 09/12/2024,2024-12-09T17:16:34+0100,Chaussures pas cher et qui fait le taf pour commencer la course à pied !,5/5
Pascale | France | 08/12/2024,2024-12-08T18:41:01+0100,"Non seulement de glisser sur sol mouillé, la semelle n'adhère pas sur beaucoup de surfaces parisiennes.",3/5
Odette | France | 08/12/2024,2024-12-08T14:44:40+0100,"Tres beau design, sa agripe bien sur les montées même sur l'herbe! Je recommande vivement.",5/5
Ilef | France | 07/12/2024,2024-12-07T20:15:51+0100,Très satisfaite,5/5
Emmanuelle | France | 07/12/2024,2024-12-07T19:28:01+0100,"Semelle très glissante sur sol humide, type macadam, bord trottoir...",1/5
Sandrine | Femme | France | 07/12/2024,2024-12-07T13:13:19+0100,Super produit,5/5
Carine | Femme | France | 07/12/2024,2024-12-07T11:46:35+0100,"Chaussures parfaites pour moi qui suis débutante, rapport qualité/prix, très bien, je recommande",5/5
Karine | Femme | France | 06/12/2024,2024-12-06T22:34:09+0100,Article très confortable,5/5
Nathalie | France | 06/12/2024,2024-12-06T18:12:48+0100,Chaussures très confortable.,5/5
BORIS | Femme | France | 06/12/2024,2024-12-06T08:50:56+0100,"Après plusieurs minutes d’utilisation, une gêne importante est apparue au niveau de l’ouverture d’une des baskets. Pourtant je n’avais rien ressenti au moment de l’essayage avant achat.  Je recommande le produit mais avec réserve.",3/5
Corinne | France | 06/12/2024,2024-12-06T10:22:50+0100,Je ne les utilise pas pour le sport.,5/5
maite | France | 06/12/2024,2024-12-06T09:46:08+0100,Le vendeur m as très mal renseigné  Je voulais des chaussures pour une marche rapide qui ne glissent pas  Il m.as conseille celle ci qui glissent énormément,1/5
oliver | Homme | France | 05/12/2024,2024-12-05T18:46:46+0100,Ras.,5/5
Joëlle | France | 05/12/2024,2024-12-05T17:34:28+0100,"Très bon rapport qualité, prix. Chaussure confortable et look sympa. Je conseille.",5/5
Eric | France | 05/12/2024,2024-12-05T08:50:22+0100,Utilisées par ma fille. Celle-ci a souhaité racheter les mêmes lorsque la première paire a été trop petite.,5/5
Evelyne | France | 05/12/2024,2024-12-05T05:47:16+0100,"Très bon. Je suis satisfaite. Petit bémol, les semelles glissent en temps de pluie. A ne pas utiliser pour la course sous la pluie.",5/5
Patricia | France | 05/12/2024,2024-12-05T09:19:46+0100,J'aimerais d'autres couleurs,5/5
Florine | France | 04/12/2024,2024-12-04T18:48:04+0100,Top pour la marche,5/5
Monique | France | 04/12/2024,2024-12-04T18:31:38+0100,Très bon produit bon rapport qualité prix,5/5
Aurélie | France | 03/12/2024,2024-12-03T22:25:13+0100,"Non rapport qualité prix, je les utilise pour des footing de 5km et assez respirantes",5/5
annick | France | 03/12/2024,2024-12-03T20:21:04+0100,bravo super vendeuse,5/5
JOCELYNE | France | 03/12/2024,2024-12-03T18:05:05+0100,Confortable.,4/5
JOCELYNE | France | 03/12/2024,2024-12-03T18:05:05+0100,Confortable.,4/5
Myriam | France | 02/12/2024,2024-12-02T13:07:00+0100,je pensais avoir plus d'accroche au sol,5/5
Isabelle | Femme | France | 02/12/2024,2024-12-02T11:27:22+0100,Parfaites,5/5
BEATRICE | Femme | France | 01/12/2024,2024-12-01T21:07:58+0100,Bon produit,4/5
Karine | France | 01/12/2024,2024-12-01T20:34:30+0100,bon rapport qualité prix,5/5
severine | France | 02/12/2024,2024-12-02T11:24:52+0100,J acheté toujours cette paire pour le travail ou je piétine beaucoup. Par contre elles ont beaucoup augmenté par rapport à mon précédent achat.,4/5
Ed | Femme | France | 30/11/2024,2024-11-30T22:39:33+0100,"Cela fait plusieurs fois que je les achète car pas trop cher ,mais a chaque fois elles se trouent sur le dessus!! C est dommage!!",3/5
fabien | France | 30/11/2024,2024-11-30T20:42:16+0100,J'ai repris exactement les mêmes chaussures que j'ai depuis plusieurs années. Mais les lacets deviennent de plus en plus petit à chaque fois que j'en achète des nouvelles. On peut à peine les faire. Sinon très confortable,3/5
CHRISTINE | France | 30/11/2024,2024-11-30T20:00:00+0100,Bon produit,5/5
Alain | France | 30/11/2024,2024-11-30T10:04:25+0100,Très bon rapport qualité prix,5/5
georges | Homme | France | 30/11/2024,2024-11-30T09:13:09+0100,entiere satisfaction,5/5
Johnny | France | 29/11/2024,2024-11-29T22:44:48+0100,achat pour marche,5/5
Magali | France | 28/11/2024,2024-11-28T09:43:37+0100,bonne tenue souple légère,5/5
Virginie | France | 26/11/2024,2024-11-26T10:07:32+0100,bien,5/5
Roselyne | France | 26/11/2024,2024-11-26T10:57:35+0100,Très joli mais j'ai eu les dessous de pieds brûlés et des ampoules en faisant mon sport. Mise une seule dommage un achat qui ne me sers à rien,2/5
COLETTE | France | 26/11/2024,2024-11-26T09:51:39+0100,article correspondant à mes attentes.,5/5
CHRISTIANE | Femme | France | 25/11/2024,2024-11-25T20:40:36+0100,je les adore elles sont jolies et tres confortable,5/5
VERONIQUE | Femme | France | 23/11/2024,2024-11-23T22:01:24+0100,Acheter pour rééducation après fracture genou / cheville,5/5
CLAUDE | France | 23/11/2024,2024-11-23T21:49:24+0100,Correspond à mes attentes,5/5
NICOLE | Femme | France | 22/11/2024,2024-11-22T20:11:26+0100,Baskets souples et confortables,5/5
FABIENNE | Femme | France | 22/11/2024,2024-11-22T18:54:40+0100,Très satisfaite pour le quotidien,4/5
GAEL | France | 22/11/2024,2024-11-22T15:58:17+0100,Répond au besoin.,4/5
Véronique | France | 22/11/2024,2024-11-22T09:18:33+0100,"utilisation pour mon job, les chaussures sont légères et très confortables, pieds préservés ;)",5/5
Astrid | France | 22/11/2024,2024-11-22T10:06:21+0100,Un peu trop raide,5/5
Audrey | France | 21/11/2024,2024-11-21T22:06:46+0100,trés jolies et bon grip,4/5
FLORENCE | Femme | France | 21/11/2024,2024-11-21T18:57:20+0100,Très satisfaite de ces baskets,5/5
Stéphane | France | 20/11/2024,2024-11-20T08:55:08+0100,Bon produit,5/5
Sylvie | France | 19/11/2024,2024-11-19T19:48:21+0100,Super confortable,5/5
MAGALIE | France | 19/11/2024,2024-11-19T19:39:20+0100,Super léger et agréable pour toutes occasions,5/5
ELIANE | France | 19/11/2024,2024-11-19T17:08:25+0100,Confortable et bon maintient.,5/5
NATHALIE | France | 18/11/2024,2024-11-18T15:42:37+0100,Très bon produit et jolie design. Je recommande,5/5
ARNAUD | Femme | France | 18/11/2024,2024-11-18T10:56:27+0100,"Bon rapport qualité/prix, bonne stabilité et bon maintien.",4/5
CELINE | France | 18/11/2024,2024-11-18T06:44:20+0100,"Je m'en sert pour faire les cours collectifs et les randonnées extérieures, j'en suis très contente",4/5
emmylou | France | 16/11/2024,2024-11-16T18:57:11+0100,Bon produit. L'accroche et le confort sont là. Les couleurs ne sont pas trop à notre goût mais c'était la seule paire qui correspondait à nos critères et à notre budget.,4/5
Beatrice | France | 16/11/2024,2024-11-16T12:03:41+0100,Bon rapport qualité prix,4/5
JEAN CLAUDE | France | 15/11/2024,2024-11-15T10:26:45+0100,qualite prix correct,5/5
STEVE | France | 14/11/2024,2024-11-14T17:22:51+0100,"idéales pour marche quotidienne, même pour les randonnées jusquà 12 kms",5/5
Catherine | France | 14/11/2024,2024-11-14T15:49:18+0100,Bonne chaussure pour terrain plat. Je n’ai pas testé sur longue distance,5/5
Nicolas | Homme | France | 13/11/2024,2024-11-13T10:44:34+0100,Bonnes chaussures pour commencer le running,5/5
PIERRE | Homme | France | 12/11/2024,2024-11-12T18:40:24+0100,correspond à mon besoin personnelle,5/5
Wahiba | France | 12/11/2024,2024-11-12T12:03:23+0100,Je les utilise 2 fois par semaine pour du step. Et parfaite. Bon maintien et bon amorti.,5/5
ANNICK | France | 12/11/2024,2024-11-12T09:06:32+0100,elles me servent tous les jours ....super produit,5/5
Nicolas | France | 11/11/2024,2024-11-11T21:09:42+0100,La semelle manque un peu d'accroche sur certains sols lisses quand ils sont mouillés. Le maintien est satisfaisant et le confort correct.,5/5
Martine | France | 11/11/2024,2024-11-11T20:24:48+0100,J’avais les mm il y a 4 ans que j’ai usé ou presque je n’arrive pas à les jeter. J’ai repris le mm modèle XT 7 pour le maintien les semelles intérieur la légèreté l’accroche marche nature terre etc très très bon produit et j’ai fait énormément de sport dont des exped au loin,5/5
samia | France | 10/11/2024,2024-11-10T21:42:08+0100,"je rachète chaque fois la même marque, je recommande.",4/5
Corinne | Femme | France | 10/11/2024,2024-11-10T10:08:58+0100,"J'utilise ces chaussures pour la vie de tous les jours, et j'en suis tout à fait satisfaite. Je les ai depuis 6 mois et elles sont toujours en parfait état. Je les utilise aussi ponctuellement pour des balades, aucun problème.",5/5
Catherine | France | 09/11/2024,2024-11-09T20:20:44+0100,Trés bonne chaussures,5/5
Sylvie | Femme | France | 09/11/2024,2024-11-09T17:06:09+0100,"Chaussures très confortables, qui passent partout.",5/5
Stephanie | France | 08/11/2024,2024-11-08T18:43:30+0100,parfait pour la course a pied 3 fois par semaine,5/5
marion | Femme | France | 08/11/2024,2024-11-08T16:45:57+0100,Respirabilite et confort,5/5
JOLANTA | France | 07/11/2024,2024-11-07T21:58:33+0100,"Produits testé sur une course à pied de 10 km. Très confortable, aucun souci après cette distance.",5/5
Martial | France | 07/11/2024,2024-11-07T20:07:22+0100,"chaussures agréables à porter, mais je trouve qu'elles ont tendance à s'user un peu vite ! Peut-être que je fais trop de kilomètres avec !",5/5
Marlene | France | 07/11/2024,2024-11-07T18:54:32+0100,Ras,4/5
Isabelle | France | 07/11/2024,2024-11-07T18:26:31+0100,Glissant sur sol mouillé,4/5
Apolline | Femme | France | 07/11/2024,2024-11-07T14:58:42+0100,"Je les porte plusieurs fois par semaine pour de la marche depuis plus d'un an et franchement elles sont super. Confortable, bon amorti. Super rapport qualité/prix. En revanche elles ne sont pas imperméable. Mais pour le prix c'est parfait.",5/5
Philippe | France | 06/11/2024,2024-11-06T16:35:20+0100,"Utilisé pour de la marche rapide et footing light. Bon confort, bon maintien.",5/5
Isabelle | France | 06/11/2024,2024-11-06T11:03:49+0100,Bon rapport qualité prix. Conseil avec le sourire de la vendeuse,4/5
PATRICIA | Femme | France | 06/11/2024,2024-11-06T11:10:02+0100,déçu du produit acheté en juin 2024 et l arrière de la chaussure intérieur ce déchire déjà,2/5
Yohan | France | 05/11/2024,2024-11-05T12:55:06+0100,Look et très souple,5/5
JEAN LOUIS | France | 05/11/2024,2024-11-05T09:58:39+0100,Article conforme à mon attente,5/5
Vincent | France | 04/11/2024,2024-11-04T12:11:50+0100,Parfait,4/5
Valerie | France | 03/11/2024,2024-11-03T12:56:39+0100,Très bien,5/5
Lucile | Femme | France | 03/11/2024,2024-11-03T07:15:31+0100,Très bon produit pour débuter le trail.,5/5
MIREILLE | France | 02/11/2024,2024-11-02T18:46:32+0100,Chaussures achetées pour des séances de gym et pour de petites balades sur route ou chemin de terre.,5/5
CHRISTINE | France | 01/11/2024,2024-11-01T18:18:31+0100,"Excellent produit, très plaisant à porter.",5/5
Brigitte | France | 31/10/2024,2024-10-31T18:18:00+0100,"Bon produit, adapté à une large gamme de sports",4/5
Laurent | Femme | France | 31/10/2024,2024-10-31T08:44:41+0100,J'ai acheté ces chaussures pour faire de la marche active en plaine. Je n'ose plus les utiliser par temps humide car elles sont trop glissantes et j'ai peur de tomber.,2/5
tiphaine | France | 30/10/2024,2024-10-30T18:30:04+0100,Content de l'achat,5/5
Mylene | France | 29/10/2024,2024-10-29T22:33:17+0100,très confortable,5/5
Claire | France | 28/10/2024,2024-10-28T18:44:20+0100,"Utilisé au Parkour, très bonnes chaussures !",5/5
Corinne | France | 28/10/2024,2024-10-28T11:57:20+0100,Malgré un lassage très détendu j ai des fourmis qui apparaissent rapidement 🤔! J espère que ça va s améliorer...,3/5
Chantal | France | 28/10/2024,2024-10-28T09:12:49+0100,"Achat de la même paire de chaussure, cela me convient",5/5
Charlotte | France | 27/10/2024,2024-10-27T23:41:45+0100,Bien pour débuter,4/5
Emma | France | 28/10/2024,2024-10-28T15:37:18+0100,Lacet trop court,2/5
Alexandra | France | 27/10/2024,2024-10-27T18:33:23+0100,Très contente de mon achat,5/5
Céline | France | 27/10/2024,2024-10-27T18:03:13+0100,"Bon rapport qualité prix, utilisées en salle et en marche rapide, légère, bonne accroche...",5/5
Magali | France | 26/10/2024,2024-10-26T22:26:08+0200,"J'ai dû prendre 2 tailles au dessus sinon la couture appuyait sur mon hallux valgus et me faisait mal sans être en activité. Lors de mon 1er footing léger, douleur légère au mollet et ampoule au niveau du talon haut de la chaussure. À voir avec le temps pour l'instant, pas convaincue ...",3/5
Sarah | France | 26/10/2024,2024-10-26T19:48:41+0200,"Super rapport qualité prix, je recommande. J'adore la couleur.",5/5
Isabelle | France | 26/10/2024,2024-10-26T14:04:45+0200,"maintien bien le pied ,très légère",5/5
muriel | France | 25/10/2024,2024-10-25T18:51:54+0200,Essayer c est l adopté,5/5
Audrey | Femme | France | 25/10/2024,2024-10-25T16:33:26+0200,"Idéale pour le running ou la marche, confortables et légères",5/5
Nicolas | France | 25/10/2024,2024-10-25T09:06:48+0200,"Bon maintien, confortable",5/5
veronique | Femme | France | 25/10/2024,2024-10-25T07:02:59+0200,"Très bien, chaussures légères",5/5
Edith | France | 24/10/2024,2024-10-24T20:31:20+0200,Ce produit est très confortable. J’ai pris une pointure au-dessus de la mienne. Je m’en sers pour la marche et pour de petits footing. Ce produit fait vraiment l’affaire pour un coureur moyen qui veut faire quelques kilomètres dans la semaine. Bon rapport qualité prix.,5/5
Mohamed Abderahmane | France | 24/10/2024,2024-10-24T15:18:33+0200,Excellent produit,5/5
MARIE HELENE | Femme | France | 24/10/2024,2024-10-24T14:44:13+0200,"J'apprécie sa couleur,  j'apprécie la forme (pas allongée) j'apprécie son accroche j'apprécie son prix pour du sport à intensité modérée",4/5
Christophe | France | 23/10/2024,2024-10-23T18:11:37+0200,Ma fille l'utilise pour le sport au collège et elle est complètement satisfaite,5/5
Isabelle | France | 23/10/2024,2024-10-23T11:02:17+0200,j'achéte ce modéle car le maintien est bien pour baskets de sport au lycée et tarif moindre par rapport aux autres modéles. le tarif a toutefois augmenté de 5 euros en une seule fois c'est quand même excessif surtout que la paire de baskets n'a pas évolué dans la forme  prendre une pointure au dessus de la sienne pour etre bien,5/5
adeline | France | 22/10/2024,2024-10-22T21:33:12+0200,parfait pour les balades,5/5
Eric | France | 22/10/2024,2024-10-22T18:12:42+0200,"Bonne chaussures avec un bon amorti, pour débuter la course à pied",5/5
Elodie | Femme | France | 22/10/2024,2024-10-22T16:01:52+0200,notre filles est ravie de ces basket très confortables,5/5
Damien | France | 21/10/2024,2024-10-21T20:13:14+0200,bonne basket confortable,5/5
Christelle | France | 20/10/2024,2024-10-20T21:53:15+0200,"Chaussures parfait pour faire de la course à pied, agréable à porter, maintient bien le pied et chaussures légères, je suis très satisfaite de mon achat et je recommande.",5/5
Anne marie | France | 20/10/2024,2024-10-20T18:36:12+0200,"Elles sont très confortables, légères et surtout courent vite après mes petits fils 🤣. Je recommande",5/5
Jean-philippe | France | 20/10/2024,2024-10-20T17:09:37+0200,Très bon maintien dans les chaussures. Bonne adaptation au pied large. L amorti est suffisant pour une reprise de la course à pied en douceur.,5/5
Emy | France | 20/10/2024,2024-10-20T11:23:57+0200,Je m'en sers comme chaussures pour la marche sportive elles sont vraiment top! L'amorti est vraiment bien elles ne compriment pas les pieds et ont un look passe partout que demandez de mieux!,5/5
PHILIPPE | France | 19/10/2024,2024-10-19T20:48:05+0200,Bien Pour faire des petites sorties et des marches en campagne .,4/5
bruno | France | 19/10/2024,2024-10-19T18:00:30+0200,confortable ma fille les adore.,5/5
GREGORY | France | 19/10/2024,2024-10-19T14:57:08+0200,"Très bon produit , agréable à porter , bon amorti , je recommande ce produit !!!",5/5
karine | France | 18/10/2024,2024-10-18T18:49:42+0200,"Nickel, tient bien au pied et au sol",5/5
Carole | Femme | France | 18/10/2024,2024-10-18T05:49:53+0200,"J'avais déjà eu ce modèle dans une autre couleur, je suis très satisfaite de ce produit Kalenji",5/5
Valerie | France | 17/10/2024,2024-10-17T17:48:10+0200,Légères. Bon rapport qualité prix,5/5
NATHALIE | France | 17/10/2024,2024-10-17T10:03:27+0200,utilisées en salle ; parfait maintient,5/5
Patricia | France | 17/10/2024,2024-10-17T07:13:56+0200,Je suis satisfaite de mon achat et je recommande,5/5
NATHALIE | France | 16/10/2024,2024-10-16T19:28:38+0200,"Il me manque la petite boucle à l'arrière pour enfiler le talon, c'est dommage.",5/5
Bland | Femme | France | 16/10/2024,2024-10-16T18:33:31+0200,"Très bon produit  Un maintient parfait , chaussures légères et bon accroche même sur les chemins de campagne.  Très bon rapport qualité prix",5/5
florence | Femme | France | 16/10/2024,2024-10-16T17:48:20+0200,Bon rapport qualité/prix,4/5
jean-guy | France | 15/10/2024,2024-10-15T17:28:11+0200,ras,5/5
Catherine | France | 14/10/2024,2024-10-14T15:01:31+0200,"Après quelques utilisations, un léger trou se forme déjà au niveau du pouce... je suis déçue du peu de durabilité du produit. Je ne recommande pas.",2/5
Christine | France | 14/10/2024,2024-10-14T07:43:58+0200,"Bien pour le prix, manque d'adhésion sur le bout du pied, voir avec le temps, peut s'améliorer (chaussures encore neuves)",4/5
Valérie | France | 13/10/2024,2024-10-13T21:19:29+0200,Super pour le sport,5/5
Béatrice | France | 13/10/2024,2024-10-13T11:09:28+0200,Bonne basquette. Bon rapport qualité prix. On est trés bien dedans.,5/5
Yanko | France | 13/10/2024,2024-10-13T08:57:10+0200,ok,5/5
françoise | France | 12/10/2024,2024-10-12T20:01:20+0200,Super chaussures très agréables à porter.  Très satisfaite de cet achat,5/5
Michael | France | 12/10/2024,2024-10-12T19:52:28+0200,Très bon rapport qualité prix,5/5
Nathalie | Femme | France | 12/10/2024,2024-10-12T15:19:46+0200,Bon maintien du pied. Agréables à porter  Glissantes sur sol mouillé,4/5
Céline | France | 11/10/2024,2024-10-11T19:48:24+0200,Super basic pour mes 2 a 3 courses dans la semaine en tout cas pour débuter. Zero douleur comparé à une paire acheté près de 200 euros pour me retrouver avec des Cloques sous la voûte plantaire au bout de 20 min de course.,5/5
GENEVIEVE | Femme | France | 10/10/2024,2024-10-10T18:17:40+0200,Baskets confortable avec un bon amorti . Je travaille toute la journée avec et franchement très bien.,5/5
JOCELYNE | Femme | France | 10/10/2024,2024-10-10T17:24:00+0200,"Chaussure très sympa par le look, agréable et confortable",5/5
Sophie | France | 10/10/2024,2024-10-10T09:27:42+0200,Très confortable et légère.,4/5
Dominique | France | 10/10/2024,2024-10-10T19:46:41+0200,le seul reproche est la mauvaise qualité de la toile puisque celle-ci se perce au niveau des gros orteils malgré des soins de pédicure,1/5
monica | France | 09/10/2024,2024-10-09T21:31:23+0200,Bonne calite,5/5
CHRISTIAN | Homme | France | 09/10/2024,2024-10-09T18:43:17+0200,Bon produit de bonne qualité,4/5
Marine | Femme | France | 08/10/2024,2024-10-08T14:42:58+0200,Amorti bien les pb de genoux,5/5
Mouhcine | Homme | France | 08/10/2024,2024-10-08T14:15:01+0200,très pratique,5/5
emilie | France | 08/10/2024,2024-10-08T08:53:56+0200,Bien,4/5
VALERIE | France | 08/10/2024,2024-10-08T01:42:00+0200,Ravie de mon achat. Utilisation des chaussures sans aucun problème. Je recommande,5/5
Thomas | France | 07/10/2024,2024-10-07T15:47:58+0200,"pour du sport en intérieur, elles sont très confortables.",5/5
Florent | Femme | France | 06/10/2024,2024-10-06T19:05:06+0200,Portées au quotidien pour les petites sorties,4/5
SYLVIANE | France | 06/10/2024,2024-10-06T15:04:44+0200,Conforme.  Produit satisfaisant,5/5
GERALDINE | France | 06/10/2024,2024-10-06T12:12:05+0200,"Très confortable, bon maintien",5/5
Charline | France | 06/10/2024,2024-10-06T09:03:33+0200,"Adaptées pour chemins en forêt , nature , trail mais pas adaptées pour courir sur route",5/5
LYSIANE | Femme | France | 06/10/2024,2024-10-06T08:50:15+0200,Confortables et légères,5/5
Josephine | France | 05/10/2024,2024-10-05T20:51:24+0200,Très agréable et très confortable,5/5
claire  | France | 05/10/2024,2024-10-05T18:51:32+0200,Parfait pour marcher tous les jours,5/5
Annie | France | 05/10/2024,2024-10-05T12:43:52+0200,Correspond au produit annoncé. je le recommande,5/5
Regine | France | 04/10/2024,2024-10-04T23:22:33+0200,ma troisiéme paire,5/5
Lucile | Femme | France | 04/10/2024,2024-10-04T22:42:13+0200,Achat tout récent mais tout a fait satisfaite de ma première sortie,5/5
Didier | Femme | France | 04/10/2024,2024-10-04T16:09:09+0200,Excellent rapport qualité-prix ! Très jolie couleur,5/5
Eleonore | Femme | France | 04/10/2024,2024-10-04T13:54:24+0200,chaussures utilisées pour courir sur sentier et un peu de route. Très confortables et légères. A voir dans la durée,4/5
sylvie | Femme | France | 04/10/2024,2024-10-04T12:48:10+0200,"J'utilise pour de la marche rapide, 1h(30), environ 5 fois par semaine. Semelle et amorti très agréable. Je ne cours pas. J'en suis très contente pour mon utilisation.",4/5
Richard | France | 04/10/2024,2024-10-04T11:30:21+0200,Impeccable.,5/5
Sabine | France | 04/10/2024,2024-10-04T10:05:17+0200,parfait,5/5
Ghislaine | France | 03/10/2024,2024-10-03T22:04:31+0200,Très confortable achat pour la marche de tous les jours en ville ou sur chemin. Porteuse d'une prothèse de jambe ce modèle est léger et surtout n'a pas ou peu de talon c'est super!!,5/5
Déborah | Femme | France | 03/10/2024,2024-10-03T18:15:27+0200,Elles tiennent bien aux pieds et amortissent les chocs (propos de ma fille utilisatrice de 11 ans),5/5
Philippe | France | 03/10/2024,2024-10-03T11:03:22+0200,"look sympa, par contre au niveau de la pointure c'est soit un peu petit ou un peu trop grand, mais dans l ensemble c'est correct vu le prix",3/5
Michelle | France | 03/10/2024,2024-10-03T00:40:00+0200,Tres bon produit.,5/5
michel | France | 01/10/2024,2024-10-01T20:11:55+0200,Ras,5/5
CLAUDETTE | France | 01/10/2024,2024-10-01T19:12:09+0200,Super,5/5
Richard | Femme | France | 30/09/2024,2024-09-30T22:30:26+0200,"Très bien, j'en suis très contente!!",5/5
Lil | Femme | France | 30/09/2024,2024-09-30T20:12:09+0200,Très bien,5/5
Annie | France | 30/09/2024,2024-09-30T18:29:29+0200,Un peu large pour moi.,4/5
DOLORES | Femme | France | 30/09/2024,2024-09-30T18:25:48+0200,"Très bon produit, souple, respirant,agréable à porter",5/5
YOHAN | Homme | France | 30/09/2024,2024-09-30T11:43:54+0200,basket randonnée très bien,5/5
Geraldine | France | 30/09/2024,2024-09-30T10:24:14+0200,"Achetées en 2022, j'en reprends aujourd'hui car elles sont usées, je marche beaucoup avec. j'espère que la qualité du produit est la même qu'il y a deux ans. lavage en machine, sechage rapide, légères, confortable.",5/5
Nicolas | Femme | France | 29/09/2024,2024-09-29T21:16:18+0200,"les lacets tiennent très bien, pas besoin de les refaire tous les 10 mètres!",5/5
CLAUDINE | France | 29/09/2024,2024-09-29T15:17:22+0200,bon rapport qualité prix,3/5
GAELLE | France | 29/09/2024,2024-09-29T13:41:16+0200,Très bon produit,5/5
Les Touranselles | Femme | France | 29/09/2024,2024-09-29T11:49:24+0200,Baskets idéales pour les cours d’EPS. De bonne qualité et confortable selon la fille.,5/5
VERONIQUE | Femme | France | 29/09/2024,2024-09-29T09:15:47+0200,"je les utilise depuis 6 mois uniquement pour marcher en ville, je ne fais pas de sport avec or elles sont déjà très abîmées : le bout qui se décolle, le dessin aui se décolle aussi... je suis très déçue par cet article.",2/5
Daniel | Femme | France | 29/09/2024,2024-09-29T08:54:46+0200,Très bon produit,5/5
Stephanie | France | 28/09/2024,2024-09-28T19:31:21+0200,Très confortables et efficaces mais je trouve que les crans s'usent un peu trop rapidement. Cela reste néanmoins d'un très bon rapport qualité prix.,4/5
Adeline | France | 28/09/2024,2024-09-28T19:15:25+0200,Très bien,5/5
Veronique | France | 28/09/2024,2024-09-28T19:11:01+0200,Très bien,5/5
Michel | France | 28/09/2024,2024-09-28T18:26:04+0200,Déçu par la qualité et le prix,3/5
Aude | France | 30/09/2024,2024-09-30T17:48:57+0200,"Bonjour amorti, agréable à porter",5/5
Mickael | France | 27/09/2024,2024-09-27T22:18:00+0200,Correct. Chaussure agréable,5/5
FLORENCE | Femme | France | 27/09/2024,2024-09-27T19:42:37+0200,Satisfaite de ces baskets,5/5
Linda | France | 26/09/2024,2024-09-26T21:19:28+0200,Parfait,5/5
Christian | Femme | France | 26/09/2024,2024-09-26T20:23:10+0200,"Chaussures confortables, légères et élégantes , adaptées aussi pour fitness en salle de sport à l'intérieur.",5/5
Agnes | France | 26/09/2024,2024-09-26T18:42:14+0200,"confortable, bon maintien",5/5
Caroline | France | 25/09/2024,2024-09-25T19:16:27+0200,Très bonnes chaussures. Ce n'est pas ma première paire. Pour être plus à l'aise j'ai pris une pointure de plus.,5/5
LEA | Femme | France | 25/09/2024,2024-09-25T18:45:38+0200,"Deuxième paire du type que j'achète. La précédente a tenu 8 ans ! Bon grip, bonne tenue, assez respirable. Amorti correct, niquel pour marcher, moins pour courir.",5/5
MARJORIE | France | 24/09/2024,2024-09-24T11:57:35+0200,Parfait pour le running et la marche,5/5
Elodie | France | 23/09/2024,2024-09-23T22:01:40+0200,Bonne adhérence et bonne flexibilité,5/5
irene | France | 22/09/2024,2024-09-22T14:43:56+0200,Nickel,5/5
Aurelia | France | 22/09/2024,2024-09-22T08:00:16+0200,parfaite pour la course sur tapis. très jolie. j'aime beaucoup,5/5
Frédéric | France | 22/09/2024,2024-09-22T00:48:30+0200,RAS,5/5
Isabelle | France | 21/09/2024,2024-09-21T21:53:38+0200,"Chaussures de ma fille, pratique pour le sport mais aussi pour tout les jours",5/5
Isabelle | France | 21/09/2024,2024-09-21T20:30:35+0200,J'achète depuis plusieurs années ce modèle pour faire de la marche aussi bien dans les bois que sur du plat ou du bitume. Souffrant d'un problème de voûte plantaire j'ai peiné à trouver un modèle adapté. Ces chaussures sont parfaites pour moi.,5/5
THIBAULT | Homme | France | 21/09/2024,2024-09-21T18:35:42+0200,2eme paire que j achète. Très bon rapport qualité prix.,5/5
Frederique | France | 21/09/2024,2024-09-21T18:19:54+0200,Bon maintien mais tige peu souple. A voir avec le tps.,5/5
Isabelle | France | 20/09/2024,2024-09-20T17:49:45+0200,Chaussure de sport confortable qui accroche bien au sol. Le look va avec bcp de tenues et elles sont très confortables. J'aime bcp le maintien du pied.,5/5
EDITH | France | 20/09/2024,2024-09-20T16:46:22+0200,"confortables, contente de mon achat",5/5
Inès | Femme | France | 20/09/2024,2024-09-20T13:04:10+0200,Chaussures de sport femme,5/5
Fatima | Femme | France | 18/09/2024,2024-09-18T18:05:57+0200,Très bon produit,5/5
clement | France | 18/09/2024,2024-09-18T09:38:48+0200,confortable,5/5
melanie | France | 18/09/2024,2024-09-18T07:43:11+0200,juste pris une taille au dessus,5/5
Patricia | France | 17/09/2024,2024-09-17T13:25:45+0200,Agréable à porter,5/5
Bruno | Homme | France | 16/09/2024,2024-09-16T20:16:16+0200,Très bien pour une initiation au running,5/5
Karine | France | 15/09/2024,2024-09-15T19:23:59+0200,Légère et bon amorti,5/5
Muriel | France | 15/09/2024,2024-09-15T11:20:36+0200,"confortable, pour la marche, légère. bon amorti.",5/5
Michel | Femme | France | 14/09/2024,2024-09-14T19:22:52+0200,je connais ces chaussures et c'est la 2ème paire que j'achète. Elles me servent principalement pour marcher dans des terrains plutôt caillouteux. j'en suis très contente.,4/5
RICHARD | France | 14/09/2024,2024-09-14T19:14:27+0200,Excellent rapport qualité prix. Très bon produit,5/5
linda | France | 14/09/2024,2024-09-14T19:10:43+0200,Par temps de pluie elles glissent dommage à voir dans le temps pour la qualité car je marche énormément,5/5
Patricia | France | 14/09/2024,2024-09-14T19:06:30+0200,très confortable,5/5
dominique | France | 13/09/2024,2024-09-13T17:26:59+0200,j'utilise ces chaussures pour ma vie de tous les jours,4/5
Corinne | Femme | France | 13/09/2024,2024-09-13T13:54:05+0200,C'est la 2ème paires que j'achète je les trouve très bien et confortables 😊,5/5
Sylvie | Femme | France | 13/09/2024,2024-09-13T10:19:21+0200,Basket de très bonne qualité agréable a porté,5/5
Delphine | France | 13/09/2024,2024-09-13T09:45:47+0200,très confortables,5/5
GERALDINE | France | 13/09/2024,2024-09-13T08:45:06+0200,Chaussures très confortable.,5/5
david | France | 11/09/2024,2024-09-11T21:49:06+0200,Très bonne chaussure de running pour ma fille de 14 ans !,5/5
Christelle | France | 11/09/2024,2024-09-11T17:03:50+0200,"Bonjour, Ces chaussures n'auront durée que 8 semaines avant de laisser apparaître un trou au niveau du gros orteil. Produit de mauvaise qualité",1/5
Delphine | France | 09/09/2024,2024-09-09T16:44:07+0200,"pratique au Quotidien, semelle anti-glisse appréciable",5/5
JACKIE | France | 08/09/2024,2024-09-08T17:42:06+0200,parfait pour courir avec mon chien,5/5
Ludivine | France | 10/09/2024,2024-09-10T11:57:23+0200,RAS,3/5
Christelle | France | 08/09/2024,2024-09-08T13:41:53+0200,très agréable,5/5
Camille | France | 08/09/2024,2024-09-08T12:45:15+0200,"Pas très cher mais pas adapté pour du running, douleurs au talon, peu d’amorti",2/5
Sandrine | France | 08/09/2024,2024-09-08T12:29:28+0200,confortables et look sympa,5/5
MANUEL | Homme | France | 08/09/2024,2024-09-08T10:29:34+0200,Super,5/5
Françoise | France | 07/09/2024,2024-09-07T13:53:10+0200,Produit au top pour la marche,5/5
REGINE | France | 06/09/2024,2024-09-06T16:38:41+0200,Très confortable pour tous les jours,5/5
ISABELLE | France | 05/09/2024,2024-09-05T20:26:29+0200,Elles sont agréables à porter et légères,4/5
FRANCOISE | France | 05/09/2024,2024-09-05T13:04:14+0200,Chaussures très légères et confortables.,5/5
Amanda | Femme | France | 04/09/2024,2024-09-04T21:37:55+0200,Très satisfaite et 2eme fois en 5 ans que je les rachète,5/5
Stéphanie | Femme | France | 04/09/2024,2024-09-04T19:50:10+0200,Achetées pour courir occasionnellement. Donc très peu portées et commencent déjà à se trouer au bout du pied…,3/5
Cecile | France | 03/09/2024,2024-09-03T18:35:35+0200,Très bon produit . Bon rapport qualité prix.,5/5
MARYSE | France | 02/09/2024,2024-09-02T20:05:09+0200,"Utilisées pour m'entrainer en endurance et en vitesse sur tapis; Confortable, bon amorti",4/5
Marie-Laure | France | 01/09/2024,2024-09-01T16:14:16+0200,"semelle avec accroche, idéal pour tout terrain",5/5
Sandrine | France | 03/09/2024,2024-09-03T15:21:09+0200,Pour sport en extérieur,5/5
Florent | Homme | France | 31/08/2024,2024-08-31T09:30:10+0200,Choisies par ma fille elle ne les quittent plus,5/5
CHANTAL | France | 30/08/2024,2024-08-30T14:33:26+0200,Bon rapport qualité prix,5/5
Sylvie | France | 29/08/2024,2024-08-29T20:42:03+0200,"Produit peu cher mais qui ne durera pas dans le temps si vous marchez tous les jours. Je ne le recommande pas dans ce cas là. Le renfort du bout n'étant pas assez étendu, la toile commence déjà à se percer...dommage, elles sont vraiment confortables.",3/5
CEDRIC | France | 29/08/2024,2024-08-29T18:59:58+0200,très confortable et légère. je recommande,5/5
Sophie | Femme | France | 29/08/2024,2024-08-29T13:42:16+0200,Très confortable,5/5
XAVIER | Femme | France | 29/08/2024,2024-08-29T07:23:47+0200,correspond aux attentes pour le prix.,4/5
ALBANE | France | 28/08/2024,2024-08-28T19:47:11+0200,Très bon produit ! Satisfaite !,5/5
SYLVIE | France | 30/08/2024,2024-08-30T13:14:46+0200,"Je suis déçu par cet article , j’ai un problème de nevrome de Morton et malheureusement avec ses chaussures il est impossible pour moi de faire des randonnées dans de bonnes conditions",5/5
brigitte | France | 28/08/2024,2024-08-28T07:59:11+0200,Confortable,5/5
Celine | France | 25/08/2024,2024-08-25T19:14:42+0200,Pour moi un classique,5/5
Carole | France | 25/08/2024,2024-08-25T18:16:37+0200,"Bon amorti, bon design, bon rapport qualité prix. Couleur sympa. Seul bémol: ne conviennent pas quand il fait humide.",5/5
MONIQUE | France | 25/08/2024,2024-08-25T17:03:58+0200,"Basket agréable à porter, couleur sympa",4/5
Alexandre | France | 25/08/2024,2024-08-25T10:28:00+0200,Très bon produit,5/5
Martine | France | 27/08/2024,2024-08-27T17:11:42+0200,La Pointure ne correspond pas. Trop juste... J'ai dû prendre la taille supérieure... Cela reste un bon produit à voir dans la durée,4/5
Christelle | France | 25/08/2024,2024-08-25T08:51:42+0200,"Bon maintien, souple et très légère",4/5
Beatrice | France | 24/08/2024,2024-08-24T22:00:51+0200,Bon produit agréable à porter,5/5
SANDRINE | France | 24/08/2024,2024-08-24T20:05:08+0200,"jolie, le confort ok, légère mais semelles glissantes sur sol humide comme certains trottoirs, pavés et carrelage,donc je ne recommande pas",5/5
Orianne | France | 24/08/2024,2024-08-24T19:29:00+0200,"Chaussures légères, souplesse et confortables pour la marche en ville principalement.",5/5
ANNABELLE | France | 24/08/2024,2024-08-24T18:19:13+0200,Chaussures adaptées au sport pratiqué ( marche),4/5
Marie Jose | France | 26/08/2024,2024-08-26T14:40:47+0200,Rad,5/5
Magalie | France | 23/08/2024,2024-08-23T05:17:51+0200,Niquel je les utilise pour le travail.,5/5
Stephane | Femme | France | 21/08/2024,2024-08-21T20:04:51+0200,Bon produit,5/5
Fabienne | France | 21/08/2024,2024-08-21T14:27:48+0200,"Chaussures confortables et légères, parfait pour de la rando sur terrain semi accidenté, en période estivale et par temps sec",5/5
Denis | France | 20/08/2024,2024-08-20T23:34:57+0200,Ras,4/5
Christelle | France | 20/08/2024,2024-08-20T20:47:38+0200,Très bon produit,5/5
Anne Marie | France | 19/08/2024,2024-08-19T13:36:19+0200,Très agréable à porter comme des pantoufles.,4/5
LAURENT | Homme | France | 19/08/2024,2024-08-19T09:17:53+0200,bon rapport qualité prix,4/5
Sylvie | France | 18/08/2024,2024-08-18T21:29:08+0200,très satisfaite de mon achat,5/5
FRANCK | France | 18/08/2024,2024-08-18T20:49:59+0200,Très bien,5/5
Solenne | Femme | France | 18/08/2024,2024-08-18T16:50:06+0200,Chaussures utilisées pour de la balade  Satisfaite de mon achat,5/5
SOPHIE | France | 16/08/2024,2024-08-16T18:42:57+0200,"Très légère, poids et température lorsqu'il fait chaud.",5/5
Jean-luc | France | 16/08/2024,2024-08-16T08:03:01+0200,je recommande,4/5
Brigitte | France | 15/08/2024,2024-08-15T11:11:02+0200,bien correct,4/5
Aleth Angèle | Femme | France | 15/08/2024,2024-08-15T02:27:32+0200,"Il est parfait, je me sans super a l'aise et vous le conseil. Je suis à ma deuxième paire",5/5
STANISLAS | Homme | France | 14/08/2024,2024-08-14T13:23:01+0200,On s’y sent comme dans des chaussons,5/5
Nina | France | 14/08/2024,2024-08-14T12:13:38+0200,Je les utilise pour du renfo et cardio en intérieur. Elles sont confortables et tiennent bien,5/5
Sandy | France | 14/08/2024,2024-08-14T00:10:57+0200,Très bien pour le dpirt en salle de ma fille,5/5
Olivier | France | 13/08/2024,2024-08-13T20:52:49+0200,Baskets au rapport qualité prix imbattable,5/5
Corinne | Femme | France | 12/08/2024,2024-08-12T14:47:20+0200,"elles sont très agréables à porter, la semelle crantée accroche bien mais je n'aime pas trop le système d'attaches en ruban qui remplace les œillets percés directement dans la chaussure et j'aurais aimé que la languette monte un peu plus sur le pied : quand je fais mes lacets ils se prennent dans la languette.",4/5
Rodolphe | Femme | France | 11/08/2024,2024-08-11T12:06:58+0200,bonne résistance aux différents terrains et activité,4/5
jolene | France | 10/08/2024,2024-08-10T18:50:20+0200,Paire utilisée pour de la zumba et ça convient très bien,4/5
Carine | France | 09/08/2024,2024-08-09T13:26:15+0200,les chaussures rétrécissent au soleil. mes orteils touchentle bout je ne peux plus les mettre après quelques heures passées a marché au soleil.,1/5
Mathilde | France | 09/08/2024,2024-08-09T07:49:56+0200,Très bien,4/5
Laurence | Femme | France | 08/08/2024,2024-08-08T19:47:23+0200,Basket légère et très confortable !,5/5
SYLVIE | France | 08/08/2024,2024-08-08T11:45:45+0200,TRES BON PRODUIT,5/5
PHILIPPE | France | 08/08/2024,2024-08-08T00:43:22+0200,Bon rapport qualité prix je recommande,4/5
Sandra | France | 07/08/2024,2024-08-07T19:19:51+0200,Très bon produit,5/5
Catherine | France | 07/08/2024,2024-08-07T17:53:51+0200,Première paire de baskets achetée . Et très satisfaite de mon achat,5/5
Nathalie | Femme | France | 07/08/2024,2024-08-07T01:23:23+0200,"C'est la 2ème fois que j'achète ce modèle : anti-transpirant, léger, très bonne semelle. Je recommande !",5/5
Sabine | France | 06/08/2024,2024-08-06T22:31:22+0200,Très satisfaite!!,5/5
Nathalie | France | 06/08/2024,2024-08-06T13:39:59+0200,Super produit,5/5
Natacha | Femme | France | 06/08/2024,2024-08-06T12:57:16+0200,"Je débute en running. Sans vouloir prendre le 1re prix et sans besoin d’investir dans des chaussures trop onéreuses, cette paire est un bon compromis. On ressent bien l’amorti au sol. Pas de douleurs, ni aux pieds, ni aux genoux.",5/5
Fabien | France | 06/08/2024,2024-08-06T09:15:53+0200,Qualité prix au top,4/5
Perrine | Femme | France | 06/08/2024,2024-08-06T09:13:07+0200,Légères et pratiques,4/5
RICHARD | Femme | France | 04/08/2024,2024-08-04T10:54:34+0200,C la deuxième paire que j'achète car j'en suis très contente très confortable,5/5
ROBERT | Femme | France | 03/08/2024,2024-08-03T23:08:23+0200,"Une chaussure qui convient parfaitement à ma forme de pied, j'en ai plusieurs que j'utilise quotidiennement, pour le sport comme pour le loisir.",5/5
Alice | France | 03/08/2024,2024-08-03T17:06:25+0200,Très satisfaite de ces chaussures pour une pratique régulière du running sur chemin . Très bon rapport qualité prix.,5/5
Veronique | France | 03/08/2024,2024-08-03T07:44:58+0200,Bon produit,5/5
KILLIAN | France | 02/08/2024,2024-08-02T21:28:47+0200,Top,5/5
KILLIAN | France | 02/08/2024,2024-08-02T20:07:09+0200,Top,5/5
Aimie | Femme | France | 01/08/2024,2024-08-01T10:00:54+0200,Déjà ma deuxième paire achetée ! Pas utilisée pour courir mais pour promener le chien plusieurs fois par jour. De vrais chaussons mais j ai un petit doute concernant l amorti pour courir,5/5
Philippe | France | 31/07/2024,2024-07-31T21:42:42+0200,Bon produit pour debutant,5/5
CARLOS | France | 31/07/2024,2024-07-31T09:17:18+0200,Légère et agréable pour une reprise.,4/5
Valérie | France | 30/07/2024,2024-07-30T22:59:18+0200,J'aime son look et son confort,5/5
Carine | France | 01/08/2024,2024-08-01T11:52:18+0200,Pas adapté à mon utilisation (course à pied / trail) dessus,3/5
Michele | France | 30/07/2024,2024-07-30T19:03:35+0200,Des années que j'utilise tout les jours mes baskets 7km par jour toujours les mêmes,5/5
Christine | France | 29/07/2024,2024-07-29T22:36:14+0200,Taille petit,5/5
Matthieu | France | 31/07/2024,2024-07-31T14:40:29+0200,"J'utilise ces baskets pour de la marche active en ville (environ 140km/mois) et du fitness : achetée en mai dernier, la semelle est déjà bien usée donc ce sont de bonnes chaussures mais pour des entrées de gamme à 40€ et destinées au trail, je trouve que c'est vraiment juste en terme de longévité.",5/5
Dominique | France | 28/07/2024,2024-07-28T22:14:58+0200,Très confortable,4/5
Pierre | France | 26/07/2024,2024-07-26T07:19:34+0200,super,5/5
Céline | France | 25/07/2024,2024-07-25T20:25:44+0200,Les chaussures sont agréables à porter et légères.,4/5
Isabelle | France | 25/07/2024,2024-07-25T19:46:43+0200,"je prends ses baskets pour ma fille pour le sport qu'elle pratique au lycée et en dehors , baskets qui tiennent dans le temps, le bémol tarif qui a augmenté par rapport à l'an dernier de 5euros",5/5
Virginie | France | 25/07/2024,2024-07-25T17:09:31+0200,"Idéale ,bon amorti",5/5
Céline | France | 24/07/2024,2024-07-24T19:53:02+0200,RAS,4/5
AURELIE | France | 24/07/2024,2024-07-24T08:57:41+0200,Design bien mais pas assez rigide au niveau du talon cheville.,3/5
patricia | France | 23/07/2024,2024-07-23T22:48:33+0200,Légère et confortable,4/5
Pascal | France | 23/07/2024,2024-07-23T18:11:32+0200,Parfait,5/5
Joël | Femme | France | 23/07/2024,2024-07-23T15:39:52+0200,Bonne qualité,5/5
Martine | France | 23/07/2024,2024-07-23T07:21:43+0200,Bonne accroche sur tout terrain me convient très bien,5/5
Lydia | France | 25/07/2024,2024-07-25T12:36:14+0200,Bien,5/5
Cédric | France | 25/07/2024,2024-07-25T12:35:57+0200,Ma fille est enchantée,5/5
Roxane | France | 22/07/2024,2024-07-22T18:23:57+0200,très bien,5/5
FRANCK | Homme | France | 22/07/2024,2024-07-22T16:59:19+0200,tres bon rapport qualité prix. Tres bien pour des randonnées simples et occasionnelles,5/5
Kathy | Femme | France | 25/07/2024,2024-07-25T12:15:58+0200,Paire achetée en février 2024 et début juin 2024 le tissu est déjà troué à plusieurs endroits et les crampons ont quasiment disparu.  A acheter si vous ne faites pas de sport au final,2/5
farida | France | 22/07/2024,2024-07-22T10:53:22+0200,Semelle un peu glissante au sol,5/5
SEBASTIEN | France | 22/07/2024,2024-07-22T02:13:38+0200,Bonne chaussure,5/5
Eric | France | 21/07/2024,2024-07-21T09:27:46+0200,Très confortables,4/5
Jean-luc | Homme | France | 23/07/2024,2024-07-23T12:01:18+0200,basic,4/5
Rahimina | France | 20/07/2024,2024-07-20T18:48:22+0200,bon produit,4/5
Valerie | France | 20/07/2024,2024-07-20T18:23:43+0200,"Teste que sur 2 km 😃 Sinon pratique de la marche, gym tonic, Zumba",5/5
SANDRINE | France | 20/07/2024,2024-07-20T07:35:07+0200,super achat j'en suis pleinement satisfaite je recommande fortement ces baskets,5/5
Patricia | France | 22/07/2024,2024-07-22T17:47:52+0200,"Très satisfaite de mes baskets. Aimerai des couleurs fluo, orange, jaune...",5/5
Marine  | France | 19/07/2024,2024-07-19T14:15:44+0200,confortable pour les activités l'été,5/5
Elodie | Femme | France | 19/07/2024,2024-07-19T10:00:45+0200,Confortable résistante bon maintien,5/5
Lydie | France | 18/07/2024,2024-07-18T08:50:59+0200,Excellent produit très confortable,5/5
Monique | France | 17/07/2024,2024-07-17T18:56:31+0200,Très contente de mon achat,5/5
Cindy | France | 17/07/2024,2024-07-17T17:12:23+0200,Bon article avec bon rapport qualité prix,4/5
PHILIPPE | France | 17/07/2024,2024-07-17T08:11:00+0200,Confortable,4/5
Virginie | France | 17/07/2024,2024-07-17T07:26:53+0200,Basique mais pratique pour commencer la course à pied,4/5
Clarisse | France | 18/07/2024,2024-07-18T12:37:58+0200,pas bien dedans,2/5
Vincent | France | 15/07/2024,2024-07-15T16:20:06+0200,"Comme dans le titre, chaussures pratiques pour de la marche occasionnelle",5/5
CÉLINE | France | 15/07/2024,2024-07-15T12:09:30+0200,"Très bon basket, très confortable",5/5
Audrey | France | 14/07/2024,2024-07-14T23:07:19+0200,Bon produit,5/5
Laetitia | France | 14/07/2024,2024-07-14T22:53:13+0200,Problème de pied j avais un doute sur le fait que c est chaussures me donne la possibilité de faire de la marche plus intense c est gagné pas de douleur pour le moment,5/5
Evelyne | France | 14/07/2024,2024-07-14T21:33:12+0200,Très confortables. Bonne accroche sur chemins.,5/5
Nadège | Femme | France | 14/07/2024,2024-07-14T11:17:48+0200,Les baskets sont confortables et légères. Elles sont faites pour des coureurs occasionnels car l'amorti du talon se tasse avec le temps.,5/5
Ophélie | France | 14/07/2024,2024-07-14T09:59:18+0200,Super pour la marche ou rando facile,5/5
Carole | France | 13/07/2024,2024-07-13T20:41:52+0200,Bon produit,5/5
JOSE | France | 13/07/2024,2024-07-13T18:10:56+0200,Ras,4/5
Aline | France | 13/07/2024,2024-07-13T14:49:26+0200,Ras,5/5
marie | France | 12/07/2024,2024-07-12T23:13:54+0200,qualité satisfaisante,4/5
Sara | France | 12/07/2024,2024-07-12T21:05:46+0200,Bonne basket mais pas résistant (le risque au dessus s’abîme vite),5/5
PHILIPPE | France | 13/07/2024,2024-07-13T16:42:27+0200,Légère,5/5
CAROLE | France | 12/07/2024,2024-07-12T10:26:51+0200,"Bon produit qui va durer longtemps ne l'utilisant que 2 heures par semei,e",4/5
Claude | France | 12/07/2024,2024-07-12T06:14:45+0200,Conforme aux attentes,5/5
aude | France | 12/07/2024,2024-07-12T06:13:11+0200,Très bon produit rapport qualité prix,4/5
Xavier | Homme | France | 11/07/2024,2024-07-11T21:29:32+0200,Très bien,5/5
Céline | France | 11/07/2024,2024-07-11T18:33:30+0200,Très bien pour porter tous les jours Très bien pour ballade ou petites randonnées Pas assez techniques pour de la course à pieds mais pour le prix c est normal Solides et ne se déforment pas facilement,4/5
Benoit | France | 11/07/2024,2024-07-11T16:10:17+0200,bien,4/5
Maurice | France | 11/07/2024,2024-07-11T11:38:46+0200,"J'ai toujours une paire. Dommage que le modèle femme ait toujours du rose. J'ai pris une fois le modèle bleu homme, un peu plus large peut-être mais tout aussi bien.",5/5
Chantal | France | 11/07/2024,2024-07-11T07:39:52+0200,confortables et légères.,5/5
Annabelle | France | 10/07/2024,2024-07-10T18:29:16+0200,Contente,5/5
DIDIER | France | 10/07/2024,2024-07-10T16:53:43+0200,Très bon produit,5/5
laurence | Femme | France | 09/07/2024,2024-07-09T21:46:45+0200,"Jolie couleur et belle harmonie des couleurs, semelle souple, agréable à porter bon amorti",5/5
Karine | France | 10/07/2024,2024-07-10T10:59:05+0200,Bien pour le prix.,3/5
Arnaud | France | 09/07/2024,2024-07-09T10:56:58+0200,"J'ai acheté cette paire de running pour ma fille. Lors de notre passage en magasin, l'affiche vantait l'amorti de la chaussure. Après son premier ""running"", ma fille a confirmé que l'amorti était vraiment bon. Pour le moment, elle en est très satisfaite.",5/5
myriam | France | 08/07/2024,2024-07-08T19:10:21+0200,"Acheté pour ma rééducation, très satisfaite",4/5
Delphine | Femme | France | 08/07/2024,2024-07-08T18:03:01+0200,"Baskets achetées fin mars, les 2 chaussures sont déjà trouées au niveau du gros orteil, très mauvaise conception",1/5
Thierry | Homme | France | 08/07/2024,2024-07-08T12:15:30+0200,LES CHAUSSURES DE RUNNING FEMME KALENJI RUN ACTIVE GRIP GRIS CORAIL sont top acheté pour travail avec les enfants ma compagne les adore elle le porte toujours en salle pour accompagne les enfants merci décathlon,5/5
Juliette | Femme | France | 08/07/2024,2024-07-08T09:39:13+0200,Bonne chaussure mais manque un peu d'amorti,4/5
